Index,Symbol,Name,Last Sale
1409,CDIO,Cardio Diagnostics Holdings Inc. Common stock,2.7
4769,MTTR,Matterport Inc. Class A Common Stock,2.7
4618,MMLP,Martin Midstream Partners L.P. Limited Partnership,2.7
1106,BNSO,Bonso Electronics International Inc. Common Stock,2.7
1418,CDRO,Codere Online Luxembourg S.A. Ordinary Shares,2.7
6506,SLGC,SomaLogic Inc. Class A Common Stock,2.7
2182,DRTS,Alpha Tau Medical Ltd. Ordinary Shares,2.7
2975,GDC,GD Culture Group Limited Common Stock,2.7
6174,RSLS,ReShape Lifesciences Inc. Common Stock,2.7
307,ALAR,Alarum Technologies Ltd. American Depositary Share,2.7
5483,PCTTW,PureCycle Technologies Inc. Warrant,2.7
1820,CRGO,Freightos Limited Ordinary shares,2.7
6501,SLDP,Solid Power Inc. Class A Common Stock,2.7
470,AP,Ampco-Pittsburgh Corporation Common Stock,2.7
44,ABUS,Arbutus Biopharma Corporation Common Stock,2.8
421,AMS,American Shared Hospital Services Common Stock,2.8
4059,KRBP,Kiromic BioPharma Inc. Common Stock,2.8
5979,RDW,Redwire Corporation Common Stock,2.8
6126,RNXT,RenovoRx Inc. Common Stock,2.8
2408,ENLV,Enlivex Therapeutics Ltd. Ordinary Shares,2.8
531,ARAY,Accuray Incorporated Common Stock,2.8
4016,KIRK,Kirkland's Inc. COMMONSTOCK,2.8
6005,RERE,ATRenew Inc. American Depositary Shares (every three of which representing two Class A ordinary shares),2.8
4284,LOOP,Loop Industries Inc. Common Stock,2.8
2448,EPOW,Sunrise New Energy Co. Ltd Ordinary Shares,2.8
440,ANEB,Anebulo Pharmaceuticals Inc. Common Stock,2.8
30,ABEO,Abeona Therapeutics Inc. Common Stock,2.8
6093,RLX,RLX Technology Inc. American Depositary Shares each representing the right to receive one (1) Class A ordinary share,2.8
5807,PSTX,Poseida Therapeutics Inc. Common Stock,2.8
2554,EVLV,Evolv Technologies Holdings Inc. Class A Common Stock,2.8
2170,DRCT,Direct Digital Holdings Inc. Class A Common Stock,2.8
4343,LUXH,LuxUrban Hotels Inc. Common Stock,2.8
31,ABEV,Ambev S.A. American Depositary Shares (Each representing 1 Common Share),2.8
1334,CARM,Carisma Therapeutics Inc. Common Stock,2.8
872,BCLI,Brainstorm Cell Therapeutics Inc. Common Stock,2.8
4568,MIN,MFS Intermediate Income Trust Common Stock,2.8
3473,HRTG,Heritage Insurance Holdings Inc. Common Stock,2.8
4906,NEWP,New Pacific Metals Corp. Common Shares,2.8
1788,CPSH,CPS Technologies Corp. Common Stock,2.8
3038,GGE,Green Giant Inc. Common Stock,2.8
1636,CMAX,CareMax Inc. Class A Common Stock,2.8
1451,CERS,Cerus Corporation Common Stock,2.8
1013,BKD,Brookdale Senior Living Inc. Common Stock,2.8
7241,UGP,Ultrapar Participacoes S.A. (New) American Depositary Shares (Each representing one Common Share),2.8
1703,CNSL,Consolidated Communications Holdings Inc. Common Stock,2.8
1352,CBD,Companhia Brasileira de Distribuicao American Depsitary Shares; each representing one Common Share,2.8
3769,IPA,ImmunoPrecise Antibodies Ltd. Common Stock,2.8
6623,SOUN,SoundHound AI Inc Class A Common Stock,2.8
3537,HUSA,Houston American Energy Corporation Common Stock,2.8
665,ATHE,Alterity Therapeutics Limited American Depositary Shares,2.8
7307,USEA,United Maritime Corporation Common Stock,2.8
1086,BMTX,BM Technologies Inc. Common Stock,2.9
7806,YTEN,Yield10 Bioscience Inc. Common Stock,2.9
2306,EDUC,Educational Development Corporation Common Stock,2.9
1176,BRN,Barnwell Industries Inc. Common Stock,2.9
6443,SID,Companhia Siderurgica Nacional S.A. Common Stock,2.9
7783,YCBD^A,cbdMD Inc. 8.0% Series A Cumulative Convertible Preferred Stock,2.9
5323,OPXS,Optex Systems Holdings Inc. Common Stock,2.9
885,BCTXW,BriaCell Therapeutics Corp. Warrant,2.9
1102,BNR,Burning Rock Biotech Limited American Depositary Shares,2.9
3151,GNSS,Genasys Inc. Common Stock,2.9
533,ARBE,Arbe Robotics Ltd. Ordinary Shares,2.9
2720,FIP,FTAI Infrastructure Inc. Common Stock ,2.9
7249,UIHC,United Insurance Holdings Corp. Common Stock,2.9
6172,RSI,Rush Street Interactive Inc. Class A Common Stock,2.9
2569,EVTV,Envirotech Vehicles Inc. Common Stock,2.9
4955,NIR,Near Intelligence Inc. Common Stock,2.9
7440,VLN,Valens Semiconductor Ltd. Ordinary Shares,2.9
3572,IAG,Iamgold Corporation Ordinary Shares,2.9
4524,MFG,Mizuho Financial Group Inc. Sponosred ADR (Japan),2.9
3227,GRRR,Gorilla Technology Group Inc. Ordinary shares,2.9
5532,PETV,PetVivo Holdings Inc. Common Stock,2.9
6765,STTK,Shattuck Labs Inc. Common Stock,2.9
6991,THWWW,Target Hospitality Corp. Warrant expiring 3/15/2024,2.9
6519,SLNHP,Soluna Holdings Inc 9.0% Series A Cumulative Perpetual Preferred Stock ,2.9
7579,WDH,Waterdrop Inc. American Depositary Shares (each representing the right to receive 10 Class A Ordinary Shares),2.9
5653,PMCB,PharmaCyte  Biotech Inc. Common Stock,2.9
4633,MNMD,Mind Medicine (MindMed) Inc. Common Shares,2.9
7350,VATE,INNOVATE Corp. Common Stock,2.9
5770,PRTG,Portage Biotech Inc. Common Stock,2.9
3795,IREN,Iris Energy Limited Ordinary Shares,2.9
4017,KITT,Nauticus Robotics Inc. Common stock,2.9
1038,BLDE,Blade Air Mobility Inc. Class A Common Stock,2.92
7306,USDP,USD Partners LP Common Units representing limited partner interest,3.0
301,AKTS,Akoustis Technologies Inc. Common Stock,3.0
5050,NRO,Neuberger Berman Real Estate Securities Income Fund Inc. Neuberger Berman Real Estate Securities Income Fund Inc.,3.0
2685,FGB,First Trust Specialty Finance and Financial Opportunities Fund,3.0
518,APYX,Apyx Medical Corporation Common Stock,3.0
3199,GRAB,Grab Holdings Limited Class A Ordinary Shares,3.0
5847,PWFL,PowerFleet Inc. Common Stock,3.0
2372,ELYM,Eliem Therapeutics Inc Common Stock,3.0
5974,RDI,Reading International Inc Class A Common Stock,3.0
7476,VOXR,Vox Royalty Corp. Common Stock,3.0
3753,INVZ,Innoviz Technologies Ltd. Ordinary shares,3.0
3910,JMIA,Jumia Technologies AG American Depositary Shares each representing two Ordinary Shares,3.0
7840,ZIVO,Zivo Bioscience Inc. Common Stock,3.0
2470,ERAS,Erasca Inc. Common Stock,3.0
2158,DOUG,Douglas Elliman Inc. Common Stock,3.0
3528,HUDI,Huadi International Group Co. Ltd. Ordinary Shares,3.0
4927,NGL,NGL ENERGY PARTNERS LP Common Units representing Limited Partner Interests,3.0
2446,EPIX,ESSA Pharma Inc. Common Stock,3.0
5142,NVX,NOVONIX Limited American Depository Shares,3.0
1762,COSM,Cosmos Health Inc. Common Stock,3.0
7779,XYF,X Financial American Depositary Shares each representing six Class A Ordinary Shares,3.0
5924,RAIL,FreightCar America Inc. Common Stock,3.0
6858,TARA,Protara Therapeutics Inc.  Common Stock,3.0
1460,CETY,Clean Energy Technologies Inc. Common Stock,3.0
5456,PBYI,Puma Biotechnology Inc Common Stock,3.0
4873,NCZ,Virtus Convertible & Income Fund II Common Shares of Beneficial Interest,3.0
4314,LSTA,Lisata Therapeutics Inc. Common Stock,3.0
2862,FSI,Flexible Solutions International Inc. Common Stock (CDA),3.1
3112,GLT,Glatfelter Corporation Common Stock,3.1
5914,QUOT,Quotient Technology Inc. Common Stock,3.1
4490,MDXH,MDxHealth SA American Depositary Shares,3.1
7268,UNIT,Uniti Group Inc. Common Stock,3.1
5090,NTRB,Nutriband Inc. Common Stock,3.1
4348,LVOX,LiveVox Holdings Inc. Class A Common Stock,3.1
5391,OXSQ,Oxford Square Capital Corp. Common Stock,3.1
2799,FOSL,Fossil Group Inc. Common Stock,3.1
3760,IONM,Assure Holdings Corp. Common Stock,3.1
5599,PIM,Putnam Master Intermediate Income Trust Common Stock,3.1
4829,NAOV,NanoVibronix Inc. Common Stock,3.1
539,ARC,ARC Document Solutions Inc. Common Stock,3.1
1903,CTSO,Cytosorbents Corporation Common Stock,3.1
5272,OMEX,Odyssey Marine Exploration Inc. Common Stock,3.1
2019,DBTX,Decibel Therapeutics Inc. Common Stock,3.1
7486,VRAY,ViewRay Inc. Common Stock,3.1
6629,SPCE,Virgin Galactic Holdings Inc. Common Stock,3.1
629,ASRV,AmeriServ Financial Inc. Common Stock,3.1
1061,BLUE,bluebird bio Inc. Common Stock,3.1
2929,GAIA,Gaia Inc. Class A Common Stock,3.1
6704,SSNT,SilverSun Technologies Inc. Common Stock,3.1
6899,TCS,Container Store (The) Common Stock,3.1
3774,IPHA,Innate Pharma S.A. ADS,3.16
5309,OPHC,OptimumBank Holdings Inc. Common Stock,3.2
3532,HUMA,Humacyte Inc. Common Stock,3.2
2594,EYPT,EyePoint Pharmaceuticals Inc. Common Stock,3.2
1743,COMP,Compass Inc. Class A Common Stock,3.2
7788,YGF,YanGuFang International Group Co. Ltd. Ordinary Shares,3.2
3389,HIVE,Hive Blockchain Technologies Ltd. Common Shares,3.2
5973,RDHL,Redhill Biopharma Ltd. American Depositary Shares,3.2
5549,PFMT,Performant Financial Corporation Common Stock,3.2
3963,KA,Kineta Inc. Common Stock,3.2
5262,OLMA,Olema Pharmaceuticals Inc. Common Stock,3.2
4090,KTRA,Kintara Therapeutics Inc. Common Stock,3.2
3597,ICLK,iClick Interactive Asia Group Limited American Depositary Shares,3.2
3591,ICD,Independence Contract Drilling Inc. Common Stock,3.2
4337,LUMO,Lumos Pharma Inc. Common Stock,3.2
3232,GRWG,GrowGeneration Corp. Common Stock,3.2
3539,HUYA,HUYA Inc. American depositary shares each  representing one Class A ordinary share,3.2
6994,TIGR,UP Fintech Holding Ltd American Depositary Share representing fifteen Class A Ordinary Shares,3.2
3640,IH,iHuman Inc. American depositary shares each representing five Class A ordinary shares,3.2
6253,SANA,Sana Biotechnology Inc. Common Stock,3.2
7747,XLO,Xilio Therapeutics Inc. Common Stock,3.2
1676,CMU,MFS Municipal Income Trust Common Stock,3.2
6919,TEDU,Tarena International Inc. American Depositary Shares,3.2
5240,OGEN,Oragenics Inc. Common Stock,3.238
6050,RHE,Regional Health Properties Inc. Common Stock,3.259
5845,PW,Power REIT (MD) Common Stock,3.3
4274,LNZA,LanzaTech Global Inc. Common Stock,3.3
2235,DWACW,Digital World Acquisition Corp. Warrants,3.3
4194,LFVN,Lifevantage Corporation Common Stock (Delaware),3.3
1321,CAMP,CalAmp Corp. Common Stock,3.3
213,AGIL,AgileThought Inc. Class A Common Stock,3.3
1681,CNDT,Conduent Incorporated Common Stock ,3.3
6490,SKYX,SKYX Platforms Corp. Common Stock,3.3
6517,SLNG,Stabilis Solutions Inc. Common Stock,3.3
3405,HLP,Hongli Group Inc. Ordinary Shares,3.3
7514,VSTA,Vasta Platform Limited Class A Ordinary Shares,3.3
1658,CMPX,Compass Therapeutics Inc. Common Stock,3.3
4425,MBIO,Mustang Bio Inc. Common Stock,3.3
2792,FORA,Forian Inc. Common Stock,3.3
5935,RBBN,Ribbon Communications Inc. Common Stock,3.3
1262,BWEN,Broadwind Inc. Common Stock,3.3
130,ADMA,ADMA Biologics Inc Common Stock,3.3
5800,PSNY,Polestar Automotive Holding UK PLC Class A ADS,3.3
862,BCAB,BioAtla Inc. Common Stock,3.3
4056,KPRX,Kiora Pharmaceuticals Inc.  Common Stock,3.3
1374,CCCC,C4 Therapeutics Inc. Common Stock,3.3
1384,CCLD,CareCloud Inc. Common Stock,3.3
4534,MGF,MFS Government Markets Income Trust Common Stock,3.3
1913,CUE,Cue Biopharma Inc. Common Stock,3.3
6255,SANG,Sangoma Technologies Corporation Common Shares,3.3
697,ATUS,Altice USA Inc. Class A Common Stock,3.3
3825,ITCB,Itau CorpBanca American Depositary Shares (each representing 1500 shares of Common Stock no par value),3.3
3776,IPSC,Century Therapeutics Inc. Common Stock,3.3
4508,MESO,Mesoblast Limited American Depositary Shares,3.3
3839,IVA,Inventiva S.A. American Depository Shares,3.3
4489,MDXG,MiMedx Group Inc Common Stock,3.3
1945,CVU,CPI Aerostructures Inc. Common Stock,3.3
2058,DFLI,Dragonfly Energy Holdings Corp. Common Stock (NV),3.3
2481,ERNA,Eterna Therapeutics Inc. Common Stock,3.38
4871,NCV,Virtus Convertible & Income Fund Common Shares of Beneficial Interest,3.4
1377,CCEL,Cryo-Cell International Inc. Common Stock,3.4
4386,MAIA,MAIA Biotechnology Inc. Common Stock,3.4
1650,CMLS,Cumulus Media Inc. Class A Common Stock,3.4
1752,COOK,Traeger Inc. Common Stock,3.4
3063,GIFI,Gulf Island Fabrication Inc. Common Stock,3.4
741,AVIR,Atea Pharmaceuticals Inc. Common Stock,3.4
4832,NAT,Nordic American Tankers Limited Common Stock,3.4
6337,SCYX,SCYNEXIS Inc. Common Stock,3.4
109,ACXP,Acurx Pharmaceuticals Inc. Common Stock,3.4
6447,SIF,SIFCO Industries Inc. Common Stock,3.4
1012,BKCC,BlackRock Capital Investment Corporation Common Stock,3.4
1147,BRAG,Bragg Gaming Group Inc. Common Shares,3.4
828,BAOS,Baosheng Media Group Holdings Limited Ordinary shares,3.4
1493,CGNT,Cognyte Software Ltd. Ordinary Shares,3.4
278,AIRI,Air Industries Group Common Stock,3.5
4965,NKTX,Nkarta Inc. Common Stock,3.5
5320,OPT,Opthea Limited American Depositary Shares,3.5
5159,NXE,Nexgen Energy Ltd. Common Shares,3.5
5438,PAYS,Paysign Inc. Common Stock,3.5
5318,OPRT,Oportun Financial Corporation Common Stock,3.5
4251,LL,LL Flooring Holdings Inc. Common Stock,3.5
1963,CXE,MFS High Income Municipal Trust Common Stock,3.5
2022,DC,Dakota Gold Corp. Common Stock,3.5
6511,SLI,Standard Lithium Ltd. Common Shares,3.5
6845,TAIT,Taitron Components Incorporated Class A Common Stock,3.5
2415,ENSC,Ensysce Biosciences Inc. Common Stock,3.5
6953,TGAN,Transphorm Inc. Common Stock,3.5
5709,PPT,Putnam Premier Income Trust Common Stock,3.5
7196,TXMD,TherapeuticsMD Inc. Common Stock,3.5
6720,STBX,Starbox Group Holdings Ltd. Ordinary Shares,3.5
2153,DOMH,Dominari Holdings Inc. Common Stock,3.5
6712,SSU,SIGNA Sports United N.V. Ordinary Share,3.5
2520,ETON,Eton Pharmaceuticals Inc. Common Stock,3.5
424,AMST,Amesite Inc. Common Stock,3.5
2609,FARM,Farmer Brothers Company Common Stock,3.52
5636,PLSE,Pulse Biosciences Inc Common Stock (DE),3.6
4125,LASE,Laser Photonics Corporation Common Stock,3.6
3644,IHRT,iHeartMedia Inc. Class A Common Stock,3.6
1187,BRTX,BioRestorative Therapies Inc. Common Stock (NV),3.6
5708,PPSI,Pioneer Power Solutions Inc. Common Stock,3.6
5449,PBI,Pitney Bowes Inc. Common Stock,3.6
6270,SB,Safe Bulkers Inc Common Stock ($0.001 par value),3.6
3178,GOTU,Gaotu Techedu Inc. American Depositary Shares,3.6
7534,VVR,Invesco Senior Income Trust Common Stock (DE),3.6
3040,GGN,GAMCO Global Gold Natural Resources & Income Trust,3.6
7571,WBX,Wallbox N.V. Class A Ordinary Shares,3.6
6707,SSSS,SuRo Capital Corp. Common Stock,3.6
3599,ICMB,Investcorp Credit Management BDC Inc. Common Stock,3.6
2040,DDL,Dingdong (Cayman) Limited American Depositary Shares (each two representing three Ordinary Shares),3.6
1544,CIA,Citizens Inc. Class A Common Stock ($1.00 Par),3.6
4958,NIU,Niu Technologies American Depositary Shares,3.6
7327,UTSI,UTStarcom Holdings Corp. Ordinary Shares,3.6
7731,XBIT,XBiotech Inc. Common Stock,3.6
486,API,Agora Inc. American Depositary Shares,3.6
1907,CUBA,Herzfeld Caribbean Basin Fund Inc. (The) Common Stock,3.6
6372,SERA,Sera Prognostics Inc. Class A Common Stock,3.6
4854,NBTX,Nanobiotix S.A. American Depositary Shares,3.64
7746,XIN,Xinyuan Real Estate Co Ltd American Depositary Shares,3.656
7453,VMEO,Vimeo Inc. Common Stock,3.7
6691,SRT,StarTek Inc. Common Stock,3.7
2176,DRIO,DarioHealth Corp. Common Stock,3.7
2228,DUOT,Duos Technologies Group Inc. Common Stock,3.7
36,ABOS,Acumen Pharmaceuticals Inc. Common Stock,3.7
5192,OABI,OmniAb Inc. Common Stock,3.7
386,AMBP,Ardagh Metal Packaging S.A. Ordinary Shares,3.7
6509,SLGL,Sol-Gel Technologies Ltd. Ordinary Shares,3.7
2907,FUSN,Fusion Pharmaceuticals Inc. Common Shares,3.7
1155,BREA,Brera Holdings PLC Class B Ordinary Shares,3.7
105,ACTG,Acacia Research Corporation (Acacia Tech) Common Stock,3.7
1340,CASI,CASI Pharmaceuticals Inc. Ordinary Shares,3.7
6361,SEER,Seer Inc. Class A Common Stock,3.7
6399,SGHC,Super Group (SGHC) Limited Ordinary Shares,3.7
4987,NMR,Nomura Holdings Inc ADR American Depositary Shares,3.7
4814,MYPS,PLAYSTUDIOS Inc.  Class A Common Stock,3.7
6233,SACH,Sachem Capital Corp. Common Shares,3.7
7461,VNET,VNET Group Inc. American Depositary Shares,3.7
1174,BRLT,Brilliant Earth Group Inc. Class A Common Stock,3.7
2133,DMTK,DermTech Inc. Common Stock,3.7
7860,ZVIA,Zevia PBC Class A Common Stock,3.7
6083,RKLB,Rocket Lab USA Inc. Common Stock,3.7
2593,EYEN,Eyenovia Inc. Common Stock,3.7
2082,DHX,DHI Group Inc. Common Stock,3.7
7517,VTEX,VTEX Class A Common Shares,3.7
5349,OSG,Overseas Shipholding Group Inc. Class A Common Stock,3.7
4185,LFCR,Lifecore Biomedical Inc. Common Stock,3.8
973,BHR,Braemar Hotels & Resorts Inc. Common Stock,3.8
5331,ORGN,Origin Materials Inc. Common Stock,3.8
3663,IMAB,I-MAB American Depositary Shares,3.8
1869,CSTE,Caesarstone Ltd. Ordinary Shares,3.8
5911,QUAD,Quad Graphics Inc Class A Common Stock,3.8
5689,POET,POET Technologies Inc. Common Shares,3.8
2067,DGLY,Digital Ally Inc. Common Stock,3.8
3386,HIO,Western Asset High Income Opportunity Fund Inc. Common Stock,3.8
7226,UCL,uCloudlink Group Inc. American Depositary Shares,3.8
3892,JFIN,Jiayin Group Inc. American Depositary Shares,3.8
4047,KODK,Eastman Kodak Company Common New,3.8
781,AXTI,AXT Inc Common Stock,3.8
2199,DSX,Diana Shipping inc. common stock,3.8
370,ALVR,AlloVir Inc. Common Stock,3.8
2311,EEX,Emerald Holding Inc. Common Stock,3.8
3042,GGR,Gogoro Inc. Ordinary Shares,3.8
6252,SAN,Banco Santander S.A. Sponsored ADR (Spain),3.8
4576,MIST,Milestone Pharmaceuticals Inc. Common Shares,3.8
4930,NGM,NGM Biopharmaceuticals Inc. Common Stock,3.8
7250,UIS,Unisys Corporation New Common Stock,3.8
1223,BTE,Baytex Energy Corp Common Shares,3.8
1705,CNTA,Centessa Pharmaceuticals plc American Depositary Shares,3.8
7254,ULBI,Ultralife Corporation Common Stock,3.8
5868,PYXS,Pyxis Oncology Inc. Common Stock,3.8
1242,BURU,Nuburu Inc. Common Stock,3.8
2055,DFFN,Diffusion Pharmaceuticals Inc. Common Stock,3.8
7448,VMAR,Vision Marine Technologies Inc. Common Shares,3.8
7110,TROO,TROOPS Inc. Ordinary Shares ,3.829
2085,DIBS,1stdibs.com Inc. Common Stock,3.9
7286,UPXI,Upexi Inc. Common Stock,3.9
2866,FSM,Fortuna Silver Mines Inc Ordinary Shares (Canada),3.9
6039,RGF,The Real Good Food Company Inc. Class A Common Stock,3.9
5041,NRDY,Nerdy Inc. Class A Common Stock,3.9
7781,YALA,Yalla Group Limited American Depositary Shares each representing one Class A Ordinary Share,3.9
532,ARBB,ARB IOT Group Limited Ordinary Shares,3.9
2333,EGHT,8x8 Inc Common Stock,3.9
5111,NUWE,Nuwellis Inc. Common Stock,3.9
3226,GRPN,Groupon Inc. Common Stock,3.9
3358,HFFG,HF Foods Group Inc. Common Stock,3.9
6392,SFWL,Shengfeng Development Limited Class A Ordinary Shares,3.9
6791,SVM,Silvercorp Metals Inc. Common Shares,3.9
6462,SIRI,Sirius XM Holdings Inc. Common Stock,3.9
6621,SOS,SOS Limited American Depositary Shares,3.9
2718,FINV,FinVolution Group American Depositary Shares,3.9
838,BBAR,Banco BBVA Argentina S.A. ADS,3.9
7530,VUZI,Vuzix Corporation Common Stock,3.9
3141,GNFT,GENFIT S.A. American Depositary Shares,3.9
4319,LTBR,Lightbridge Corporation Common Stock,3.9
5771,PRTH,Priority Technology Holdings Inc. Common Stock,3.91
2369,ELTK,Eltek Ltd. Ordinary Shares,3.92
2140,DNMR,Danimer Scientific Inc. Common Stock,4.0
452,ANPC,AnPac Bio-Medical Science Co. Ltd. American Depositary Shares,4.0
3719,INLX,Intellinetics Inc. Common Stock,4.0
422,AMSC,American Superconductor Corporation Common Stock,4.0
357,ALT,Altimmune Inc. Common Stock,4.0
4065,KRMD,KORU Medical Systems Inc. Common Stock,4.0
553,AREN,The Arena Group Holdings Inc. Common Stock,4.0
1337,CARV,Carver Bancorp Inc. Common Stock,4.0
2180,DRRX,DURECT Corporation Common Stock,4.0
5605,PIXY,ShiftPixy Inc. Common Stock,4.0
1486,CGA,China Green Agriculture Inc. Common Stock,4.0
2887,FTHM,Fathom Holdings Inc. Common Stock,4.0
5015,NOTV,Inotiv Inc. Common Stock,4.0
747,AVPT,AvePoint Inc. Class A Common Stock,4.0
3674,IMGN,ImmunoGen Inc. Common Stock,4.0
7421,VIRC,Virco Manufacturing Corporation Common Stock,4.0
7280,UPLD,Upland Software Inc. Common Stock,4.0
763,AWP,abrdn Global Premier Properties Fund Common Shares of Beneficial Interest,4.0
5035,NR,Newpark Resources Inc. Common Stock,4.0
1423,CDXS,Codexis Inc. Common Stock,4.0
6109,RMNI,Rimini Street Inc. (DE) Common Stock,4.01
5614,PL,Planet Labs PBC Class A Common Stock,4.1
1329,CAPR,Capricor Therapeutics Inc. Common Stock,4.1
6228,SABR,Sabre Corporation Common Stock,4.1
6607,SOL,Emeren Group Ltd American Depositary Shares each representing 10 shares,4.1
3918,JOBY,Joby Aviation Inc. Common Stock,4.1
2978,GDEV,Nexters Inc. Ordinary Shares,4.1
1224,BTG,B2Gold Corp Common shares (Canada),4.1
5668,PMVP,PMV Pharmaceuticals Inc. Common Stock,4.1
1408,CDE,Coeur Mining Inc. Common Stock,4.1
6709,SST,System1 Inc. Class A Common Stock,4.1
626,ASPS,Altisource Portfolio Solutions S.A. Common Stock,4.1
2956,GBIO,Generation Bio Co. Common Stock,4.1
5266,OLPX,Olaplex Holdings Inc. Common Stock,4.1
2582,EXK,Endeavour Silver Corporation Ordinary Shares (Canada),4.1
4529,MFV,MFS Special Value Trust Common Stock,4.1
1579,CJJD,China Jo-Jo Drugstores Inc. (Cayman Islands) Ordinary Shares,4.1
7716,WW,WW International Inc. Common Stock,4.1
6469,SJ,Scienjoy Holding Corporation Class A Ordinary Shares ,4.1
3658,IKNA,Ikena Oncology Inc. Common Stock,4.1
4473,MDGS,Medigus Ltd. American Depositary Shares,4.1
506,APT,Alpha Pro Tech Ltd. Common Stock,4.1
4632,MNKD,MannKind Corporation Common Stock,4.1
4057,KPTI,Karyopharm Therapeutics Inc. Common Stock,4.1
1646,CMCT,Creative Media & Community Trust Corporation Common stock,4.1
5899,QRTEB,Qurate Retail Inc. Series B Common Stock ,4.17
1424,CDZI,CADIZ Inc. Common Stock,4.2
4199,LGL,LGL Group Inc. (The) Common Stock,4.2
5481,PCTI,PCTEL Inc. Common Stock,4.2
1922,CURV,Torrid Holdings Inc. Common Stock,4.2
7618,WHLM,Wilhelmina International Inc. Common Stock,4.2
3313,HBIO,Harvard Bioscience Inc. Common Stock,4.2
7168,TUSK,Mammoth Energy Services Inc. Common Stock,4.2
5278,OMQS,OMNIQ Corp. Common Stock,4.2
6734,STIX,Semantix Inc. Class A Ordinary Shares,4.2
1766,COYA,Coya Therapeutics Inc. Common Stock,4.2
1887,CTIC,CTI BioPharma Corp. (DE) Common Stock,4.2
7484,VRAR,The Glimpse Group Inc. Common Stock,4.2
1830,CRMD,CorMedix Inc. Common Stock,4.2
6152,ROVR,Rover Group Inc. Class A Common Stock,4.2
451,ANNX,Annexon Inc. Common Stock,4.2
4305,LSAK,Lesaka Technologies Inc. Common Stock,4.2
5554,PFSW,PFSweb Inc. Common Stock,4.29
4689,MQ,Marqeta Inc. Class A Common Stock,4.3
3069,GIM,Templeton Global Income Fund Inc. Common Stock,4.3
6983,THRD,Third Harmonic Bio Inc. Common Stock,4.3
637,ASTS,AST SpaceMobile Inc. Class A Common Stock,4.3
6384,SFIX,Stitch Fix Inc. Class A Common Stock,4.3
5275,OMH,Ohmyhome Limited Ordinary Shares,4.3
2973,GCV,Gabelli Convertible and Income Securities Fund Inc. (The) Common Stock,4.3
6146,ROOT,Root Inc. Class A Common Stock,4.3
1608,CLNE,Clean Energy Fuels Corp. Common Stock,4.3
7163,TTSH,Tile Shop Holdings Inc. Common Stock,4.3
335,ALLK,Allakos Inc. Common Stock,4.3
2754,FLUX,Flux Power Holdings Inc. Common Stock,4.3
893,BDN,Brandywine Realty Trust Common Stock,4.3
2858,FSCO,FS Credit Opportunities Corp. Common Stock,4.3
3322,HCDIP,Harbor Custom Development Inc. 8.0% Series A Cumulative Convertible Preferred Stock no par value,4.3
5207,OCC,Optical Cable Corporation Common Stock,4.389
875,BCOV,Brightcove Inc. Common Stock,4.4
7015,TLF,Tandy Leather Factory Inc. Common Stock,4.4
4303,LRMR,Larimar Therapeutics Inc. Common Stock,4.4
5197,OB,Outbrain Inc. Common Stock,4.4
450,ANIX,Anixa Biosciences Inc. Common Stock,4.4
1996,DALN,DallasNews Corporation Series A Common Stock,4.4
548,ARDX,Ardelyx Inc. Common Stock,4.4
4707,MRSN,Mersana Therapeutics Inc. Common Stock,4.4
372,ALXO,ALX Oncology Holdings Inc. Common Stock,4.4
940,BGCP,BGC Partners Inc Class A Common Stock,4.4
4294,LPSN,LivePerson Inc. Common Stock,4.4
2432,EOD,Allspring Global Dividend Opportunity Fund Common Shares of Beneficial Interest,4.4
7047,TNGX,Tango Therapeutics Inc.,4.4
6425,SHIP,Seanergy Maritime Holdings Corp Common Stock,4.4
3250,GSM,Ferroglobe PLC Ordinary Shares,4.4
504,APRE,Aprea Therapeutics Inc. Common stock,4.4
2340,EGY,VAALCO Energy Inc.  Common Stock,4.4
4601,MLEC,Moolec Science SA Ordinary Shares,4.4
2881,FTCH,Farfetch Limited Class A Ordinary Shares,4.4
5079,NTCO,Natura &Co Holding S.A. American Depositary Shares ,4.4
6031,RFIL,RF Industries Ltd. Common Stock,4.4
6920,TEF,Telefonica SA Common Stock,4.4
4328,LTRX,Lantronix Inc. Common Stock,4.4
3010,GENI,Genius Sports Limited Ordinary Shares,4.4
3070,GIPR,Generation Income Properties Inc. Common Stock,4.4
1139,BPTS,Biophytis SA American Depositary Share,4.4
7713,WVE,Wave Life Sciences Ltd. Ordinary Shares,4.4
162,AEG,AEGON N.V. Common Stock,4.4
5097,NU,Nu Holdings Ltd. Class A Ordinary Shares,4.4
3571,IAF,abrdn Australia Equity Fund Inc. Common Stock,4.4
1849,CSBR,Champions Oncology Inc. Common Stock,4.5
6051,RHE^A,Regional Health Properties Inc. 10.875% Series A Cumulative Redeemable Preferred Stock,4.5
3418,HMY,Harmony Gold Mining Company Limited,4.5
4624,MMT,MFS Multimarket Income Trust Common Stock,4.5
2195,DSP,Viant Technology Inc. Class A Common Stock,4.5
6971,THCH,TH International Limited Ordinary shares,4.5
4053,KOSS,Koss Corporation Common Stock,4.5
274,AIP,Arteris Inc. Common Stock,4.5
3828,ITI,Iteris Inc. Common Stock,4.5
5566,PGRE,Paramount Group Inc. Common Stock,4.5
813,BAER,Bridger Aerospace Group Holdings Inc. Common Stock,4.5
6195,RVPH,Reviva Pharmaceuticals Holdings Inc. Common Stock ,4.5
7011,TKC,Turkcell Iletisim Hizmetleri AS Common Stock,4.5
7635,WIT,Wipro Limited Common Stock,4.5
2296,EDF,Virtus Stone Harbor Emerging Markets Income Fund Common Shares of Beneficial Interest,4.5
836,BB,BlackBerry Limited Common Stock,4.5
2295,EDD,Morgan Stanley Emerging Markets Domestic Debt Fund Inc. Morgan Stanley Emerging Markets Domestic Debt Fund Inc. Common Stock,4.5
3937,JRSH,Jerash Holdings (US) Inc. Common Stock,4.5
3049,GHG,GreenTree Hospitality Group Ltd. American depositary shares each representing one Class A ordinary share,4.5
6753,STRO,Sutro Biopharma Inc. Common Stock,4.5
2368,ELSE,Electro-Sensors Inc. Common Stock,4.561
5339,ORLA,Orla Mining Ltd. Common Shares,4.6
1064,BLZE,Backblaze Inc. Class A Common Stock,4.6
7116,TRT,Trio-Tech International Common Stock,4.6
1331,CARA,Cara Therapeutics Inc. Common Stock,4.6
5066,NSL,Nuveen Senior Income Fund Common Stock,4.6
4028,KMDA,Kamada Ltd. Ordinary Shares,4.6
2659,FEAM,5E Advanced Materials Inc. Common Stock,4.6
6619,SOPH,SOPHiA GENETICS SA Ordinary Shares,4.6
279,AIRS,AirSculpt Technologies Inc. Common Stock,4.6
2257,EAF,GrafTech International Ltd. Common Stock,4.6
2259,EAR,Eargo Inc. Common Stock,4.6
1499,CHCI,Comstock Holding Companies Inc. Class A Common Stock,4.6
6933,TESS,TESSCO Technologies Incorporated Common Stock,4.7
