Index,Symbol,Name,Last Sale
4718,MS^K,Morgan Stanley Depositary Shares each representing 1/1000th of a share of Fixed-to-Floating Rate Non-Cumulative Preferred Stock  Series K,24.9
1448,CEQP,Crestwood Equity Partners LP,24.9
2458,EQC^D,Equity Commonwealth 6.50% Pfd Conv Shs Ser D,24.9
1531,CHSCM,CHS Inc Class B Reset Rate Cumulative Redeemable Preferred Stock Series 3,24.9
3188,GPJA,Georgia Power Company Series 2017A 5.00% Junior Subordinated Notes due October 1 2077,24.9
6127,ROAD,Construction Partners Inc. Class A Common Stock,24.9
5422,PARAA,Paramount Global Class A Common Stock,24.9
2599,F^B,Ford Motor Company 6.20% Notes due June 1 2059,24.9
5335,ORI,Old Republic International Corporation Common Stock,24.9
6081,RJF^B,Raymond James Financial Inc. Depositary Shares each representing a 1/40th interest in a share of 6.375% Fixed-to-Floating Rate Series B Non-Cumulative Perpetual Preferred Stock,24.9
2628,FBMS,First Bancshares Inc.,24.9
1897,CTRA,Coterra Energy Inc. Common Stock,24.9
5230,OEC,Orion Engineered Carbons S.A Common Shares,24.9
6269,SAY,Saratoga Investment Corp 8.125% Notes due 2027,24.9
1663,CMRE^C,Costamare Inc. Perpetual Preferred Series C (Marshall Islands),25.0
4421,MBINM,Merchants Bancorp Depositary Shares Each Representing a 1/40th Interest in a Share of 8.25% Fixed-Rate Reset Series D Non-Cumulative Perpetual Preferred Stock,25.0
7120,TRTN^B,Triton International Limited 8.00% Series B Cumulative Redeemable Perpetual Preference Shares,25.0
1532,CHSCN,CHS Inc Preferred Class B Series 2 Reset Rate,25.0
1135,BPOPM,Popular Inc. Popular Capital Trust II - 6.125% Cumulative Monthly Income Trust Preferred Securities,25.0
3189,GPK,Graphic Packaging Holding Company,25.0
7186,TWNK,Hostess Brands Inc. Class A Common Stock,25.0
3471,HROWM,Harrow Health Inc. 11.875% Senior Notes due 2027,25.0
106,ACU,Acme United Corporation. Common Stock,25.0
1080,BMN,BlackRock 2037 Municipal Target Term Trust Common Shares of Beneficial Interest,25.0
4511,MET^E,MetLife Inc. Depositary shares each representing a 1/1000th interest in a share of the Issuera??s 5.625% Non-Cumulative Preferred Stock Series E.,25.0
7096,TRINL,Trinity Capital Inc. 7.00% Notes Due 2025,25.0
2535,EVA,Enviva Inc. Common Stock,25.0
2223,DUKB,Duke Energy Corporation 5.625% Junior Subordinated Debentures due 2078,25.0
958,BHB,Bar Harbor Bankshares Inc. Common Stock,25.0
4574,MIRM,Mirum Pharmaceuticals Inc. Common Stock,25.0
3876,JBK,Lehman ABS 3.50 3.50% Adjustable Corp Backed Tr Certs GS Cap I,25.0
6110,RMPL^,RiverNorth Capital and Income Fund 5.875%% Series A Term Preferred Stock $0.0001 par value per share,25.0
5946,RCA,Ready Capital Corporation 7.00% Convertible Senior Notes due 2023,25.0
7742,XFLT^A,XAI Octagon Floating Rate & Alternative Income Term Trust 6.50% Series 2026 Term Preferred Shares (Liquidation Preference $25.00),25.029
6855,TANNZ,TravelCenters of America Inc. 8.00% Senior Notes due 2030,25.099
3249,GSL^B,Global Ship Lease Inc. Depository Shares Representing 1/100th Perpetual Preferred Series B% (Marshall Island),25.099
6461,SIRE,Sisecam Resources LP Common Units representing limited partner interests,25.1
3135,GMRE^A,Global Medical REIT Inc. Series A Cumulative Redeemable Preferred Stock,25.1
5651,PLYM^A,Plymouth Industrial REIT Inc. 7.50% Series A Cumulative Redeemable Preferred Stock,25.1
2779,FNLC,First Bancorp Inc  (ME) Common Stock,25.1
7089,TREE,LendingTree Inc. Common Stock,25.1
801,BAC^B,Bank of America Corporation Depositary Shares each representing a 1/1000th interest in a share of 6.000% Non-Cumulative Preferred Stock Series GG,25.1
468,AOSL,Alpha and Omega Semiconductor Limited Common Shares,25.1
3926,JPM^D,J P Morgan Chase & Co Depositary Shares each representing a 1/400th  interest in a share of 5.75% Non-Cumulative  Preferred Stock Series DD,25.1
861,BC^C,Brunswick Corporation 6.375% Notes due 2049,25.1
3238,GS^J,Goldman Sachs Group Inc Depositary Shs Repstg 1/1000th Pfd Ser J Fixed to Fltg Rate,25.1
6853,TANNI,TravelCenters of America Inc. 8.25% Senior Notes due 2028,25.139
1297,C^J,Citigroup Inc. Dep Shs Repstg 1/1000 Pfd Ser J Fixed/Fltg,25.2
1298,C^K,Citigroup Inc. Dep Shs Repstg 1/1000th Pfd Ser K,25.2
7495,VRNS,Varonis Systems Inc. Common Stock,25.2
6059,RILY,B. Riley Financial Inc. Common Stock,25.2
1664,CMRE^D,Costamare Inc. 8.75% Series D Cumulative Redeemable Perpetual Preferred Stock,25.2
6867,TBC,AT&T Inc. 5.625% Global Notes due 2067,25.2
1381,CCJ,Cameco Corporation Common Stock,25.2
5729,PRH,Prudential Financial Inc. 5.950% Junior Subordinated Notes due 2062,25.2
6812,SWTX,SpringWorks Therapeutics Inc. Common Stock,25.2
1233,BTU,Peabody Energy Corporation Common Stock ,25.2
4715,MS^E,Morgan Stanley DEPOSITARY SHARES REP 1/1000TH SHARES FIXED/FLTG PREFERRED STOCK SERIES E,25.3
1665,CMRE^E,Costamare Inc. 8.875% Series E Cumulative Redeemable Perpetual Preferred Stock par value $0.0001,25.3
6271,SB^C,Safe Bulkers Inc Cumulative Redeemable Perpetual Preferred Series C (Marshall Islands),25.3
4033,KMT,Kennametal Inc. Common Stock,25.3
6333,SCVL,Shoe Carnival Inc. Common Stock,25.3
5069,NSS,NuStar Logistics L.P. 7.625% Fixed-to-Floating Rate Subordinated Notes due 2043,25.3
2395,ENBA,Enbridge Inc 6.375% Fixed-to-Floating Rate Subordinated Notes Series 2018-B due 2078,25.3
4265,LNC^D,Lincoln National Corporation Depositary Shares Each Representing a 1/1000th Interest in a Share of 9.000% Non-Cumulative Preferred Stock Series D,25.3
6854,TANNL,TravelCenters of America Inc. 8.00% Senior Notes due 2029,25.3
1181,BRP,BRP Group Inc. (Insurance Company) Class A Common Stock,25.3
4723,MSB,Mesabi Trust Common Stock,25.3
5061,NS^C,Nustar Energy L.P. 9.00% Series C Fixed-to-Floating Rate Cumulative Redeemable Perpetual Preferred Units,25.3
7119,TRTN^A,Triton International Limited 8.50% Series A Cumulative Redeemable Perpetual  Preference Shares,25.304
3103,GLP^B,Global Partners LP 9.50% Series B Fixed Rate Cumulative Redeemable Perpetual Preferred Units representing limited partner interests,25.399
6764,STT^G,State Street Corporation Depositary shares each representing a 1/4000th ownership interest in a share of Fixed-to-Floating Rate Non-Cumulative,25.4
6223,RZB,Reinsurance Group of America Incorporated 5.75% Fixed-To-Floating Rate Subordinated Debentures due 2056,25.4
5281,ONBPO,Old National Bancorp Depositary Shares Each Representing a 1/40th Interest in a Share of Series C Preferred Stock,25.4
6468,SIX,Six Flags Entertainment Corporation New Common Stock,25.4
5087,NTNX,Nutanix Inc. Class A Common Stock,25.4
2043,DDT,Dillard's Capital Trust I,25.4
7488,VRDN,Viridian Therapeutics Inc. Common Stock,25.4
1777,CPHC,Canterbury Park Holding Corporation 'New' Common Stock,25.4
6827,SYM,Symbotic Inc. Class A Common Stock,25.4
1731,COFS,ChoiceOne Financial Services Inc. Common Stock,25.4
4505,MER^K,Bank of America Corporation Income Capital Obligation Notes initially due December 15 2066,25.4
3683,IMOS,ChipMOS TECHNOLOGIES INC. American Depositary Shares,25.4
3239,GS^K,Goldman Sachs Group Inc. (The) Dep Shs Repstg 1/1000 Int Sh Fxd/Fltg Non Cum Pfd Stk Ser K,25.4
859,BC^A,Brunswick Corporation 6.500% Senior Notes due 2048,25.41
329,ALL^B,Allstate Corporation (The) 5.100% Fixed-to-Floating Rate Subordinated Debentures due 2053,25.5
6766,STVN,Stevanato Group S.p.A. Ordinary Shares,25.5
2200,DSX^B,Diana Shipping Inc. Perpetual Preferred Shares Series B (Marshall Islands),25.5
572,ARNC,Arconic Corporation Common Stock ,25.5
3735,INST,Instructure Holdings Inc. Common Stock,25.5
7598,WF,Woori Financial Group Inc. American Depositary Shares (each representing three (3) shares of Common Stock),25.5
3737,INT,World Fuel Services Corporation Common Stock,25.5
3656,IIPR^A,Innovative Industrial Properties Inc. 9.00% Series A Cumulative Redeemable Preferred Stock,25.5
4706,MRO,Marathon Oil Corporation Common Stock,25.5
3925,JPM^C,J P Morgan Chase & Co Depositary Shares each representing a 1/400th interest in a share of 6.00% Non-Cumulative  Preferred Stock Series EE,25.5
3380,HIG^G,Hartford Financial Services Group Inc. (The) Depositary Shares each representing a 1/1000th interest in a share of 6.000% Non-Cumulative Preferred Stock Series G $0.01 par value,25.5
5804,PSTG,Pure Storage Inc. Class A Common Stock,25.6
4721,MS^P,Morgan Stanley Depositary Shares each representing 1/1000th of a share of 6.500% Non-Cumulative Preferred Stock Series P,25.6
1356,CBL,CBL & Associates Properties Inc. Common Stock,25.6
5510,PEBO,Peoples Bancorp Inc. Common Stock,25.6
5780,PSA^H,Public Storage Depositary Shares Each Representing 1/1000 of a  5.60% Cumulative Preferred  Share of Beneficial Interest Series H,25.6
7469,VNT,Vontier Corporation Common Stock ,25.6
7070,TOWN,TowneBank Common Stock,25.7
6216,RY^T,Royal Bank Of Canada 6.750% Fixed Rate/Floating Rate Noncumulative First Preferred Shares Series C-2,25.7
6095,RM,Regional Management Corp. Common Stock,25.7
7597,WEYS,Weyco Group Inc. Common Stock,25.7
2222,DUK^A,Duke Energy Corporation Depositary Shares each representing a 1/1000th interest in a share of 5.75% Series A Cumulative Redeemable Perpetual Preferred Stock,25.7
860,BC^B,Brunswick Corporation 6.625% Senior Notes due 2049,25.792
7516,VSTO,Vista Outdoor Inc. Common Stock,25.8
2935,GAM^B,General American Investors Company Inc. Cumulative Preferred Stock,25.8
6111,RMR,The RMR Group Inc. Class A Common Stock,25.8
6774,SUM,Summit Materials Inc. Class A Common Stock,25.8
4885,NEE^N,NextEra Energy Inc. Series N Junior Subordinated Debentures due March 1 2079,25.8
6569,SNDR,Schneider National Inc. Common Stock,25.8
5635,PLRX,Pliant Therapeutics Inc. Common Stock,25.8
6907,TDOC,Teladoc Health Inc. Common Stock,25.9
6710,SSTI,ShotSpotter Inc. Common Stock,25.9
1545,CIB,BanColombia S.A. Common Stock,25.9
3900,JHG,Janus Henderson Group plc Ordinary Shares,25.9
5078,NTB,Bank of N.T. Butterfield & Son Limited (The) Voting Ordinary Shares,25.9
7266,UNFI,United Natural Foods Inc. Common Stock,25.9
3637,IGT,International Game Technology Ordinary Shares,26.0
2724,FITB,Fifth Third Bancorp Common Stock,26.0
82,ACIW,ACI Worldwide Inc. Common Stock,26.0
339,ALLY,Ally Financial Inc. Common Stock,26.0
1073,BMEA,Biomea Fusion Inc. Common Stock,26.0
2174,DRH^A,Diamondrock Hospitality Company 8.250% Series A Cumulative Redeemable Preferred Stock,26.0
4515,METCL,Ramaco Resources Inc. 9.00% Senior Notes due 2026,26.0
5977,RDNT,RadNet Inc. Common Stock,26.0
3102,GLP^A,Global Partners LP 9.75% Series A Fixed-to-Floating Rate Cumulative Redeemable Perpetual Preferred Units representing limited partner interests,26.051
4317,LSXMB,Liberty Media Corporation Series B Liberty SiriusXM Common Stock,26.1
594,ARWR,Arrowhead Pharmaceuticals Inc. Common Stock,26.1
6424,SHG,Shinhan Financial Group Co Ltd American Depositary Shares,26.1
2243,DXPE,DXP Enterprises Inc. Common Stock,26.1
7162,TTP,Tortoise Pipeline & Energy Fund Inc. Common Stock,26.1
3534,HUN,Huntsman Corporation Common Stock,26.1
3413,HMC,Honda Motor Company Ltd. Common Stock,26.1
3062,GIC,Global Industrial Company Common Stock,26.1
545,ARCT,Arcturus Therapeutics Holdings Inc. Common Stock,26.1
216,AGL,agilon health inc. Common Stock,26.1
4420,MBIN,Merchants Bancorp Common Stock,26.1
6224,RZC,Reinsurance Group of America Incorporated 7.125% Fixed-Rate Reset Subordinated Debentures due 2052,26.2
3904,JILL,J. Jill Inc. Common Stock,26.2
1322,CAMT,Camtek Ltd. Ordinary Shares,26.2
647,ATAT,Atour Lifestyle Holdings Limited American Depositary Shares,26.2
1386,CCLDP,CareCloud Inc. 11% Series A Cumulative Redeemable Perpetual Preferred Stock,26.207
5749,PRO,PROS Holdings Inc. Common Stock,26.3
5288,ONEW,OneWater Marine Inc. Class A Common Stock,26.3
1530,CHSCL,CHS Inc Class B Cumulative Redeemable Preferred Stock Series 4,26.3
442,ANF,Abercrombie & Fitch Company Common Stock,26.3
751,AVTA,Avantax Inc. Common Stock,26.3
6736,STK,Columbia Seligman Premium Technology Growth Fund Inc,26.3
2445,EPD,Enterprise Products Partners L.P. Common Stock,26.3
6165,RRC,Range Resources Corporation Common Stock,26.3
2646,FCPT,Four Corners Property Trust Inc. Common Stock,26.3
2513,ETD,Ethan Allen Interiors Inc. Common Stock,26.3
3535,HURC,Hurco Companies Inc. Common Stock,26.33
7201,TY,Tri Continental Corporation Common Stock,26.4
3775,IPI,Intrepid Potash Inc Common Stock,26.4
5454,PBT,Permian Basin Royalty Trust Common Stock,26.4
7287,URBN,Urban Outfitters Inc. Common Stock,26.4
2832,FRG,Franchise Group Inc. Common Stock,26.4
3650,IIIN,Insteel Industries Inc. Common Stock,26.4
5490,PDCO,Patterson Companies Inc. Common Stock,26.5
4675,MP,MP Materials Corp. Common Stock,26.5
824,BANFP,BancFirst Corporation - BFC Capital Trust II Cumulative Trust Preferred Securities,26.5
2759,FMBH,First Mid Bancshares Inc. Common Stock,26.5
3419,HNI,HNI Corporation Common Stock,26.5
359,ALTG^A,Alta Equipment Group Inc. Depositary Shares (each representing 1/1000th in a share of 10% Series A Cumulative Perpetual Preferred Stock),26.5
7185,TWN,Taiwan Fund Inc. (The) Common Stock,26.6
910,BEN,Franklin Resources Inc. Common Stock,26.6
1265,BWMN,Bowman Consulting Group Ltd. Common Stock,26.6
2451,EPR^E,EPR Properties Series E Cumulative Conv Pfd Shs Ser E,26.6
3333,HCP,HashiCorp Inc. Class A Common Stock,26.6
4413,MAXN,Maxeon Solar Technologies Ltd. Ordinary Shares,26.6
219,AGM^C,Federal Agricultural Mortgage Corporation Preferred Series C Fixed to Fltg,26.6
3567,HZO,MarineMax Inc.  (FL) Common Stock,26.7
1533,CHSCO,CHS Inc. Class B Cumulative Redeemable Preferred Stock,26.7
3156,GNTY,Guaranty Bancshares Inc. Common Stock,26.7
1832,CRNC,Cerence Inc. Common Stock,26.7
3492,HSTM,HealthStream Inc. Common Stock,26.7
3147,GNLX,Genelux Corporation Common Stock,26.7
7114,TRS,TriMas Corporation Common Stock,26.8
7136,TSBK,Timberland Bancorp Inc. Common Stock,26.8
703,AU,AngloGold Ashanti Limited Common Stock,26.8
2086,DICE,DICE Therapeutics Inc. Common Stock,26.8
3155,GNTX,Gentex Corporation Common Stock,26.8
7005,TITN,Titan Machinery Inc. Common Stock,26.8
2876,FTAI,FTAI Aviation Ltd. Common Stock,26.8
7592,WES,Western Midstream Partners LP Common Units Representing Limited Partner Interests,26.9
3809,ISEE,IVERIC bio Inc. Common Stock,27.0
1128,BOX,Box Inc. Class A Common Stock,27.0
923,BFH,Bread Financial Holdings Inc. Common Stock,27.0
2883,FTDR,Frontdoor Inc. Common Stock,27.0
6036,RGC,Regencell Bioscience Holdings Limited Ordinary Shares,27.1
6365,SEM,Select Medical Holdings Corporation Common Stock,27.1
7573,WCC^A,WESCO International Inc. Depositary Shares each representing 1/1000th interest in a share of Series A Fixed-Rate Reset Cumulative Perpetual Preferred Stock,27.1
5828,PTSI,P.A.M. Transportation Services Inc. Common Stock,27.2
5246,OHI,Omega Healthcare Investors Inc. Common Stock,27.3
1541,CHX,ChampionX Corporation Common Stock ,27.3
6342,SDGR,Schrodinger Inc. Common Stock,27.3
2750,FLO,Flowers Foods Inc. Common Stock,27.3
6866,TBBK,The Bancorp Inc Common Stock,27.3
4088,KTN,Structured Products Corp 8.205% CorTS 8.205% Corporate Backed Trust Securities (CorTS),27.3
5218,OCN,Ocwen Financial Corporation NEW Common Stock,27.4
164,AEHR,Aehr Test Systems Common Stock,27.5
5775,PRVA,Privia Health Group Inc. Common Stock,27.5
2757,FLYW,Flywire Corporation Voting Common Stock,27.5
1393,CCRD,CoreCard Corporation Common Stock,27.5
672,ATLC,Atlanticus Holdings Corporation Common Stock,27.5
1941,CVR,Chicago Rivet & Machine Co. Common Stock,27.5
892,BDL,Flanigan's Enterprises Inc. Common Stock,27.5
3303,HASI,Hannon Armstrong Sustainable Infrastructure Capital Inc. Common Stock,27.6
6020,REYN,Reynolds Consumer Products Inc. Common Stock,27.6
7234,UFCS,United Fire Group Inc. Common Stock,27.6
1245,BVH,Bluegreen Vacations Holding Corporation Class A Common Stock,27.6
3159,GO,Grocery Outlet Holding Corp. Common Stock,27.7
4418,MBCN,Middlefield Banc Corp. Common Stock,27.7
7256,ULH,Universal Logistics Holdings Inc. Common Stock,27.7
6561,SNBR,Sleep Number Corporation Common Stock,27.8
800,BAC,Bank of America Corporation Common Stock,27.8
7224,UCBI,United Community Banks Inc. Common Stock,27.8
7029,TMCI,Treace Medical Concepts Inc. Common Stock,27.8
5424,PARR,Par Pacific Holdings Inc.  Common Stock,27.8
592,ARVN,Arvinas Inc. Common Stock,27.8
7073,TPG,TPG Inc. Class A Common Stock,27.9
4450,MCFT,MasterCraft Boat Holdings Inc. Common Stock,27.9
4375,LZB,La-Z-Boy Incorporated Common Stock,27.9
1739,COLD,Americold Realty Trust Inc. Common Stock,28.0
2957,GBLI,Global Indemnity Group LLC Class A Common Stock (DE),28.0
5145,NWFL,Norwood Financial Corp. Common Stock,28.0
2179,DRQ,Dril-Quip Inc. Common Stock,28.0
4916,NFE,New Fortress Energy Inc. Class A Common Stock,28.0
4318,LSXMK,Liberty Media Corporation Series C Liberty SiriusXM Common Stock,28.1
4743,MT,Arcelor Mittal NY Registry Shares NEW,28.1
5769,PRTC,PureTech Health plc American Depositary Shares,28.1
7134,TS,Tenaris S.A. American Depositary Shares,28.1
782,AY,Atlantica Sustainable Infrastructure plc Ordinary Shares,28.1
5602,PINS,Pinterest Inc. Class A Common Stock,28.2
1010,BJRI,BJ's Restaurants Inc. Common Stock,28.3
7021,TLK,PT Telekomunikasi Indonesia Tbk,28.3
4316,LSXMA,Liberty Media Corporation Series A Liberty SiriusXM Common Stock,28.3
2390,EMO,ClearBridge Energy Midstream Opportunity Fund Inc. Common Stock,28.3
2376,EMBC,Embecta Corp. Common Stock,28.3
5838,PUK,Prudential Public Limited Company Common Stock,28.3
5561,PGC,Peapack-Gladstone Financial Corporation Common Stock,28.3
6016,REX,REX American Resources Corporation,28.3
3507,HTH,Hilltop Holdings Inc.,28.3
1368,CC,Chemours Company (The) Common Stock,28.4
2751,FLR,Fluor Corporation Common Stock,28.4
5150,NWPX,Northwest Pipe Company Common Stock,28.4
3989,KEN,Kenon Holdings Ltd. Ordinary Shares,28.4
6576,SNN,Smith & Nephew SNATS Inc. Common Stock,28.5
1021,BKR,Baker Hughes Company Class A Common Stock,28.5
7529,VTYX,Ventyx Biosciences Inc. Common Stock,28.5
5707,PPL,PPL Corporation Common Stock,28.5
448,ANIK,Anika Therapeutics Inc. Common Stock,28.5
1873,CSV,Carriage Services Inc. Common Stock,28.5
6824,SYF,Synchrony Financial Common Stock,28.6
1058,BLTE,Belite Bio Inc American Depositary Shares,28.6
7853,ZTO,ZTO Express (Cayman) Inc. American Depositary Shares each representing one Class A ordinary share.,28.6
3484,HSII,Heidrick & Struggles International Inc. Common Stock,28.6
4287,LOVE,The Lovesac Company Common Stock,28.7
2463,EQNR,Equinor ASA,28.7
7102,TRMD,TORM plc Class A Common Stock,28.8
1299,C^N,Citigroup Capital XIII 7.875% Fixed rate Floating Rate trust Preferred Securities (TruPS),28.8
7366,VCTR,Victory Capital Holdings Inc. Class A Common Stock,28.8
7750,XNCR,Xencor Inc. Common Stock,28.8
4878,NDP,Tortoise Energy Independence Fund Inc. Common Stock,28.8
4943,NI,NiSource Inc Common Stock,28.8
1228,BTO,John Hancock Financial Opportunities Fund Common Stock,28.8
2785,FNWD,Finward Bancorp Common Stock,28.87
1462,CEVA,CEVA Inc. Common Stock,28.9
5520,PENN,PENN Entertainment Inc. Common Stock,28.9
5900,QRTEP,Qurate Retail Inc. 8.0% Fixed Rate Cumulative Redeemable Preferred Stock,28.9
4434,MBWM,Mercantile Bank Corporation Common Stock,28.9
1932,CVGW,Calavo Growers Inc. Common Stock,28.9
402,AMLX,Amylyx Pharmaceuticals Inc. Common Stock,29.0
1473,CFG,Citizens Financial Group Inc. Common Stock,29.0
2857,FSBW,FS Bancorp Inc. Common Stock,29.0
7320,UTG,Reaves Utility Income Fund Common Shares of Beneficial Interest,29.0
3083,GLBE,Global-E Online Ltd. Ordinary Shares,29.0
6329,SCSC,ScanSource Inc. Common Stock,29.1
5080,NTCT,NetScout Systems Inc. Common Stock,29.1
1884,CTGO,Contango ORE Inc. Common Stock,29.2
326,ALKS,Alkermes plc Ordinary Shares,29.2
84,ACLX,Arcellx Inc. Common Stock,29.2
3458,HPQ,HP Inc. Common Stock,29.2
1485,CG,The Carlyle Group Inc. Common Stock,29.2
1373,CCBG,Capital City Bank Group Common Stock,29.3
7835,ZION,Zions Bancorporation N.A. Common Stock,29.3
3355,HESM,Hess Midstream LP Class A Share,29.3
5292,ONON,On Holding AG Class A Ordinary Shares,29.3
6312,SCHN,Schnitzer Steel Industries Inc. Class A Common Stock,29.3
6589,SNV,Synovus Financial Corp. Common Stock,29.4
1896,CTR,ClearBridge MLP and Midstream Total Return Fund Inc. Common Stock,29.4
1571,CIR,CIRCOR International Inc. Common Stock,29.4
2626,FBIZ,First Business Financial Services Inc. Common Stock,29.4
4446,MCB,Metropolitan Bank Holding Corp. Common Stock,29.4
2186,DRVN,Driven Brands Holdings Inc. Common Stock,29.4
1534,CHSCP,CHS Inc. 8%  Cumulative Redeemable Preferred Stock,29.5
2627,FBK,FB Financial Corporation Common Stock,29.5
6235,SAFE,Safehold Inc. New Common Stock ,29.5
556,ARGO,Argo Group International Holdings Ltd.,29.5
5117,NVCN,Neovasc Inc. Common Shares,29.5
3595,ICHR,Ichor Holdings Ordinary Shares,29.5
2251,E,ENI S.p.A. Common Stock,29.6
6530,SM,SM Energy Company Common Stock,29.6
2796,FORM,FormFactor Inc. FormFactor Inc. Common Stock,29.6
404,AMNB,American National Bankshares Inc. Common Stock,29.6
7654,WMB,Williams Companies Inc. (The) Common Stock,29.6
5423,PARAP,Paramount Global 5.75% Series A Mandatory Convertible Preferred Stock,29.7
2710,FIBK,First Interstate BancSystem Inc. Class A Common Stock,29.7
900,BEAM,Beam Therapeutics Inc. Common Stock,29.7
6116,RNG,RingCentral Inc. Class A Common Stock,29.7
3023,GFF,Griffon Corporation Common Stock,29.7
4483,MDU,MDU Resources Group Inc. Common Stock (Holding Company),29.7
7724,WY,Weyerhaeuser Company Common Stock,29.8
6123,RNST,Renasant Corporation Common Stock,29.8
7549,WAFD,Washington Federal Inc. Common Stock,29.8
6390,SFST,Southern First Bancshares Inc. Common Stock,29.9
7467,VNOM,Viper Energy Partners LP Common Unit,29.9
4177,LEU,Centrus Energy Corp. Class A Common Stock,29.9
5633,PLOW,Douglas Dynamics Inc. Common Stock,30.0
7683,WRK,Westrock Company Common Stock,30.0
2129,DMLP,Dorchester Minerals L.P. Common Units Representing Limited Partnership Interests,30.0
7362,VCEL,Vericel Corporation Common Stock,30.0
1876,CSX,CSX Corporation Common Stock,30.0
2813,FRAF,Franklin Financial Services Corporation Common Stock,30.0
7769,XPOF,Xponential Fitness Inc. Class A Common Stock,30.1
7686,WSBC,WesBanco Inc. Common Stock,30.1
7203,TYG,Tortoise Energy Infrastructure Corporation Common Stock,30.1
7768,XPO,XPO Inc. Common Stock,30.1
2965,GBX,Greenbrier Companies Inc. (The) Common Stock,30.2
3101,GLP,Global Partners LP Global Partners LP Common Units representing Limited Partner Interests,30.2
2680,FFIN,First Financial Bankshares Inc. Common Stock,30.2
2654,FDP,Fresh Del Monte Produce Inc. Common Stock,30.2
7812,YY,JOYY Inc. American Depositary Shares,30.2
399,AMK,AssetMark Financial Holdings Inc. Common Stock,30.3
780,AXTA,Axalta Coating Systems Ltd. Common Shares,30.3
6719,STBA,S&T Bancorp Inc. Common Stock,30.3
88,ACNB,ACNB Corporation Common Stock,30.4
911,BEP,Brookfield Renewable Partners L.P. ,30.4
7227,UCTT,Ultra Clean Holdings Inc. Common Stock,30.4
5586,PHR,Phreesia Inc. Common Stock,30.4
3195,GPRE,Green Plains Inc. Common Stock,30.5
3468,HRMY,Harmony Biosciences Holdings Inc. Common Stock,30.5
3540,HVBC,HV Bancorp Inc. Common Stock,30.5
1789,CPSI,Computer Programs and Systems Inc. Common Stock,30.6
743,AVNS,Avanos Medical Inc. Common Stock,30.6
2802,FOX,Fox Corporation Class B Common Stock,30.7
1933,CVI,CVR Energy Inc. Common Stock,30.7
4087,KTH,Structures Products Cp 8% CorTS Issued by Peco Energy Cap Tr II Preferred Stock,30.7
1700,CNP,CenterPoint Energy Inc (Holding Co) Common Stock,30.7
7552,WAL,Western Alliance Bancorporation Common Stock (DE),30.7
524,AQNU,Algonquin Power & Utilities Corp. Corporate Units,30.7
4170,LEG,Leggett & Platt Incorporated Common Stock,30.7
2229,DV,DoubleVerify Holdings Inc. Common Stock,30.8
2742,FLGT,Fulgent Genetics Inc. Common Stock,30.9
7785,YELP,Yelp Inc. Common Stock,30.9
5509,PEBK,Peoples Bancorp of North Carolina Inc. Common Stock,30.9
7115,TRST,TrustCo Bank Corp NY Common Stock,30.9
666,ATHM,Autohome Inc. American Depositary Shares each representing four class A ordinary shares.,31.0
4107,KYMR,Kymera Therapeutics Inc. Common Stock,31.0
5741,PRLB,Proto Labs Inc. Common stock,31.1
7207,U,Unity Software Inc. Common Stock,31.1
7216,UBER,Uber Technologies Inc. Common Stock,31.1
3542,HVT/A,Haverty Furniture Companies Inc.,31.1
1841,CRTO,Criteo S.A. American Depositary Shares,31.2
4042,KNTK,Kinetik Holdings Inc. Class A Common Stock,31.2
5563,PGNY,Progyny Inc. Common Stock,31.2
2273,EBTC,Enterprise Bancorp Inc Common Stock,31.2
4131,LAZ,Lazard LTD. Lazard LTD. Class A Common Stock,31.3
3541,HVT,Haverty Furniture Companies Inc. Common Stock,31.4
3066,GIL,Gildan Activewear Inc. Class A Sub. Vot. Common Stock,31.4
3886,JEF,Jefferies Financial Group Inc. Common Stock,31.4
3751,INVH,Invitation Homes Inc. Common Stock,31.4
1180,BROS,Dutch Bros Inc. Class A Common Stock,31.4
1653,CMP,Compass Minerals Intl Inc Common Stock,31.4
1103,BNRE,Brookfield Reinsurance Ltd. Class A Exchangeable Limited Voting Shares,31.5
2551,EVH,Evolent Health Inc Class A Common Stock,31.5
1088,BN,Brookfield Corporation Class A Limited Voting Shares,31.5
6955,TGH,Textainer Group Holdings Limited Common Shares,31.5
4342,LUV,Southwest Airlines Company Common Stock,31.5
7656,WMG,Warner Music Group Corp. Class A Common Stock,31.5
1136,BPRN,Princeton Bancorp Inc. Common Stock (PA),31.6
820,BAM,Brookfield Asset Management Inc Class A Limited Voting Shares,31.6
5305,OPCH,Option Care Health Inc. Common Stock,31.6
6771,SU,Suncor Energy  Inc. Common Stock,31.6
1953,CWEN,Clearway Energy Inc. Class C Common Stock,31.7
2842,FRME,First Merchants Corporation Common Stock,31.7
396,AMH,American Homes 4 Rent Common Shares of Beneficial Interest,31.7
4617,MMI,Marcus & Millichap Inc. Common Stock,31.8
2339,EGRX,Eagle Pharmaceuticals Inc. Common Stock,31.8
2537,EVBG,Everbridge Inc. Common Stock,31.8
2797,FORR,Forrester Research Inc. Common Stock,31.9
5201,OBNK,Origin Bancorp Inc. Common Stock,31.9
473,APAM,Artisan Partners Asset Management Inc. Class A Common Stock,31.9
2148,DOCS,Doximity Inc. Class A Common Stock,31.9
4963,NKSH,National Bankshares Inc. Common Stock,31.9
